<?xml version="1.0"?>

<!DOCTYPE benchmark SYSTEM "benchmark.dtd" >

<benchmark>
  <measures>

    <time>
      <name>taskTime</name>
      <startOn>
        <type>onInit</type>
      </startOn>
      <stopOn>
         <type>never</type>
      </stopOn>
    </time>

    <positionError>	
      <name>positionError</name>
      <target> girona500 </target>
      <position>
        <x>0</x>
        <y>0</y>
        <z>0</z>
      </position>
      <topic> position </topic>
      <startOn>
	<type>onInit</type>
      </startOn>
      <stopOn>
	<type>never</type>
      </stopOn>
    </positionError>

    <pathFollowing>
      <name>pathFollowing</name>
      <target> girona500 </target>
      <topic> path </topic>
      <from> localizedWorld </from>
      <log> 0.1 </log>
      <startOn>
	<type>onInit</type>
      </startOn>
      <stopOn>
	<type>never</type>
      </stopOn>
    </pathFollowing>

  </measures>

  <startOn>
     <type>service</type>
     <target> startBench </target>
  </startOn>

  <stopOn>
     <type>service</type>
     <target> stopBench </target>
  </stopOn> 
    
  <function publishRate="0.5" publishResult="true">taskTime</function>

  <sceneUpdater> 
    <none />
  </sceneUpdater>

</benchmark>
