<?xml version="1.0"?>

<!DOCTYPE benchmark SYSTEM "benchmark.dtd" >

<benchmark>
  <measures>

    <euclideanNorm>
      <name>corners</name>
      <groundTruth type="cornersFromCamera">
	<camera>bowtech1</camera>
	<target>blackbox</target>
	<publishOn> autoInit</publishOn>
      </groundTruth>	
      <target> cornersTopic </target>
      <startOn>
	<type>onInit</type>
      </startOn>
      <stopOn>
	<type>never</type>
      </stopOn>
    </euclideanNorm>

    <euclideanNorm>
      <name>centroid</name>
      <groundTruth type="centroidFromCamera">
	<camera>bowtech1</camera>
	<target>blackbox</target>
      </groundTruth>	
      <target> centroidTopic </target>
      <startOn>
	<type>onInit</type>
      </startOn>
      <stopOn>
	<type>never</type>
      </stopOn>
    </euclideanNorm>

  </measures>

  <startOn>
     <type>service</type>
     <target> startBench </target>
  </startOn>

  <stopOn>
     <type>never</type>
  </stopOn> 
    
  <function>corners+centroid</function>


  <sceneUpdater> 
    <currentForceUpdater>
      <initialCurrent>0.05</initialCurrent>
      <finalCurrent>0.05</finalCurrent>
      <sphericalDirection>
      <theta> 1.57 </theta>
        <phi> 0 </phi>
        </sphericalDirection>
      <forceVariation> 0.01 </forceVariation>
      <forcePeriod> 1 </forcePeriod>
      <directionVariation>
	<theta> 0 </theta>
	<phi> 2.43 </phi>	
      </directionVariation>
      <directionPeriod>
  	<theta> 4 </theta>
  	<phi> 4 </phi>	
      </directionPeriod>
      <random> 0.1 </random>
      <step>0.02</step>
      <interval>10</interval>
      <target>girona500</target>
      <sceneUpdater> 
        <sceneFogUpdater>
          <initialFog>0</initialFog>
          <finalFog>2.0</finalFog>
          <step>0.05</step>
          <interval>5</interval>
        </sceneFogUpdater>
      </sceneUpdater>
    </currentForceUpdater>
  </sceneUpdater>

</benchmark>
